Job Title,Company Name,Location,Job Description,Job role,Education,Key Skill,Reviews,Applicants,Openings
DNB /DM - Cardiology(Fresher),Narayana Health NH,KolkataWest Bengal BangaloreBengaluru,Narayana Hrudayalaya Hospital Group Indias leading healthcare provider invites dynamic and passionate healthcare professionals to join the groupWe invite applications for the following positionsPosition Junior Consultant CardiologyQualification DNBDM CardiologyLocation BangaloreA medical professional with or without experience in cardiology would be preferred Interested medical professionals can contact Raghavendra and forward updated resume toraghavendrahnarayanahealthorgThanks  RegardsRaghavendra,Role Doctor  OtherIndustry Type Medical Services  HospitalDepartment Healthcare  Life SciencesEmployment Type Full Time PermanentRole Category Doctor,EducationPG MedicalMSMD in Any SpecializationDoctorate PhDDoctorate,Key SkillsSkills highlighted with ‘‘ are preferred keyskillsCardiologistDNB CardiologyInterventional CardiologyDM Cardiologycardiology,4.21354,197.0,1
Full-Time Content Writer & Academic Content Writer (Work From Home),Capital Infotech,Kolkata,Greetings from Capital InfotechProfile SEO Content WriterBeing a SEO Content Writer with us you must write unique and grammatically correct content on the given topic keeping the guidelines in mind Writing AI generated content is strictly prohibittedWorking Days MonSatWorking Hours  am   pmDaily Words to be produced  wordsday This is a permanent work from home jobMust have A working laptopdesktop and a stable internet connectionThe interview procedure includes writtenA st Round written Assignment  wordsB nd Round Written Assignment  wordsAfter completing these  rounds we would conduct an Induction paid of  days to familiarize you with our existing projects and how we workOn the basis of your performance during the interview rounds and induction your salary would be finalizedLanguage English Required Must have a good hold over both verbal and written English Must be wellversed in MS Office Must have a good typing speed Must be able to frame sentences on own Must adhere to deadlineProfile Academic Content writer Fresher must not applySubjects in Academic writing  Business Management HR medical law finance statistics python Java SQL Pure Mthematics with calculationReference style  Harvard MHRA APA MLA OscolaCountry UK USA AustraliaJob Types Fulltime Permanent Work from homeMust have A working laptopdesktop and a stable internet connectionWorking Days Monday to SaturdayWorking Hours  am to  pmDaily Words to be produced  wordsday Interview rounds  written tests   days of inductionEducation Bachelors RequiredExperience Minimum  year of fulltime experience is a mustSalary of academic writer  depending on experience level and interview performance,Role Content Editorial  Journalism  OtherIndustry Type Content Development  LanguageDepartment Content Editorial  JournalismEmployment Type Full Time PermanentRole Category Content Editorial  Journalism  Other,EducationUG Any GraduatePG Any PostgraduateDoctorate Doctorate Not Required Any Doctorate,Key SkillsSkills highlighted with ‘‘ are preferred keyskillsWeb Content Writerassignment writingacademic writerdissertation writingcontent writerPress ReleaseBlog WritingContent WritingTechnical WritingReport WritingAcademic WritingMedical WritingWritingacademic content writercontent developerArticle Writing,3.528,1535.0,5
Hiring Airtel Xstream Fiber Field Sales Executive For Kolkata,Teamlease Services Limited,KolkataWest Bengal,Mega Hiring Drive for Indias leading TelecomBroadband Company Bharti Airtel Ltd Designation  XFE Xstream Fibre ExecutiveWork Experience              Up to  years of experience broad band experience will be an added advantageSalary  Salary basis the Minimum wages of the state Deserving Candidate Salary can be discussed with Circle SPOC  approval sought Sales Executives will be applicable for all other Incentive scheme champ from time to time basis  Salary and Incentive Payout to be paid in AIRTEL PAYMENTS BANK AccountQualifications  Graduate or Higher Secondary with Field Sales Expertise in TelecomBankingInsuranceNetwork MarketingRequirements  Age Group  Years to  Years Excellent Personality  presentable Very Good Communication  Presentation Skills Up to  years of experience broad band experience will be an added advantage Excellent Command over the local language of the state Conversing in English being an added advantage Well versed skill set for approaching  handling customer Selfmotivated sincere  committed to deliver the results Smartphone is a must have and should be well versed in app knowledge Personal Vehicle  Two Wheeler Mandatory with Driving licenseJob Description  Achieve the monthly Sales target for Airtel Broadband by connecting with potential customers  convincing them to purchase broadband connection Identify Approach  Inform potential customers about the advantages of installing  subscribing to Airtel Broadband To mark their presence regularly marking in  out attendance in the Airtel APP Visit household retailers across designated area  look for potential customers to convince them for purchasing Airtel Broadband Responsible for developing leads of the prospective customers  approach them Responsible for providing on time competition feedback to circle Airtel Team To be up to date on company products  its features launched from time to timeInterested candidates can drop their resumes below undersignedEmail ID  shibangydasteamleasecomWhatsapp Number,Role Field Sales ExecutiveIndustry Type Telecom  ISPDepartment Sales  Business DevelopmentEmployment Type Full Time PermanentRole Category Retail  BC Sales,EducationUG Any GraduatePG Any Postgraduate,Key SkillsSkills highlighted with ‘‘ are preferred keyskillsField SalesField MarketingHiring Airtel Xstream Fiber Field Sales Excutive For KolkataField Sales ManagementB2C SalesB2C MarketingDirect SalesField WorkSales Executive Activities,3.92727,62.0,30
Hiring For kolkata International Voice Process,Wipro Employees choice,Kolkata,Job DescriptionWipro KOLKATA is Hiring for International Voice ProcessExcellent communication skillsELIGIBILITYFresher can apply onlyGraduate and Undergraduate both can applyExcept  Mechnical  CivilLLB B PharmaMBAShould have proper Documents Aadhaar and Pan  Double Vaccination Certificate all the marksheets of highest qualificationCandidates should be willing to work in complete Night ShiftsExcellent Communication Skills English Language OnlyShould be Comfortable in Work From OfficeINTERESTED CANDIDATE CAN SHARE THEIR CVS AT RegardsHR Moubani,Role Customer Retention  Voice  BlendedIndustry Type IT Services  ConsultingDepartment Customer Success Service  OperationsEmployment Type Full Time PermanentRole Category Voice  Blended,EducationUG BBA BMS in Any Specialization BCA in Any Specialization BSc in Any Specialization BCom in Any Specialization BA in Any Specialization,Key SkillsSkills highlighted with ‘‘ are preferred keyskillsInternational Voice ProcessInbound Customer ServiceInternational Call CenterVoice SupportInbound Voice ProcessCommunication SkillsDomestic Voice ProcessBpo VoiceDomestic VoiceTelecallingDomestic BPOInternational BPOInternational Calling,3.836401,524.0,1
International Voice Process,Wipro Employees choice,Kolkata,GreetingsWipro is hiring for International Voice ProcessLocation  Kolkata Relocation is not allowedEligibility  Undergraduates  Graduates can applyShift Timings  Night Shift Sat  Sun fixed offDesired Candidate Profile Freshers can applyCandidate with  year of experience in BPO are eligible for the sameCandidates should have good  excellent communication skills in EnglishPLEASE NOTE INTERESTED CANDIDATES SHOULD HAVE ALL THEIR DOCUMENTS ID Proofs Marksheetthth Graduation Double Vaccination EXPERIENCED CANDIDATES MUST HAVE THE ADD ON DOCUMENTS Offer letter Experience letter Salary slipsPerks and Benefits One way drop by cabPerformance based incentivesDirect payrollINTERESTED CANDIDATES KINDLY SHARED YOUR CV ON  OR zenobiamccoywiprocomPLEASE DO NOT CALLRegardsHR Zenobia,Role Voice  Blended  OtherIndustry Type BPO  Call CentreDepartment Customer Success Service  OperationsEmployment Type Full Time PermanentRole Category Voice  Blended,EducationUG Any GraduatePG Any Postgraduate,Key SkillsSkills highlighted with ‘‘ are preferred keyskillsFluent EnglishInternational Voice ProcessCommunication SkillsInternational BPO,3.836401,1961.0,1
Food & Beverage Associate,Marriott,Kolkata,Complete closing duties including storing all reusable goods breaking down goods cleaning all equipment and areas returning equipment to proper locations locking refrigerators restocking items turning off lights locking doors and completing daily cleaning checklist Set up stock and maintain work areas Inspect the cleanliness and presentation of all china glass and silver prior to use Maintain cleanliness of work areas throughout the day practicing cleanasyougo procedures     Follow all company and safety and security policies and procedures report accidents injuries and unsafe work conditions to manager and complete safety training and certifications Ensure uniform and personal appearance are clean and professional maintain confidentiality of proprietary information and protect company assets Welcome and acknowledge all guests according to company standards Speak with others using clear and professional language and answer telephones using appropriate etiquette Develop and maintain positive working relationships with others support team to reach common goals and listen and respond appropriately to the concerns of other employees    Ensure adherence to quality expectations and standards Read and visually verify information in a variety of formats eg small print Stand sit or walk for an extended period of time or for an entire work shift Move lift carry push pull and place objects weighing less than or equal to  pounds without assistance Grasp turn and manipulate objects of varying size and weight requiring fine motor skills and handeye coordination Move over sloping uneven or slippery surfaces as well as up and down stairs andor service ramps Reach overhead and below the knees including bending twisting pulling and stooping Perform other reasonable job duties as requested by Supervisors,Role BartenderIndustry Type Travel  TourismDepartment Food Beverage  HospitalityEmployment Type Full Time PermanentRole Category FB Service,EducationUG Any GraduatePG Any Postgraduate,Key SkillsSupervisorPrintingHospitalityUsageSafety trainingProgrammingInspectionWellnessManagement,4.21130,,1
Guest Services Associate - Front Office,Marriott,Kolkata,Process all guest checkins checkouts room assignments and room changelate checkout requests Secure payment activatereissue room keys Ensure rates match market codes document exceptions Verifyadjust billing for guests Communicate to appropriate staff when guests are waiting for an available room Advise guest of messages Clear departures in computer system Coordinate with Housekeeping to track room status and guest concerns File guest paperwork or documentation Operate telephone switchboard station Run and check daily reports contingency lists and credit card authorization reports Supply guests with directions and information Answer record and process all guest calls requests questions or concerns follow up to ensure each has been met to guests satisfaction Arrange transportation for guestsvisitors Count and secure bank at beginning and end of shift Cashguests checks process all payment types vouchers paidouts charges and provide change Notify Loss PreventionSecurity of any reports of theft     Follow company policies and procedures report accidents injuries and unsafe work conditions to manager ensure uniform and personal appearance are clean and professional maintain confidentiality of proprietary information protect company assets Welcome and acknowledge guests according to company standards anticipate and address guests service needs assist individuals with disabilities thank guests with genuine appreciation Speak using clear and professional language answer telephones using appropriate etiquette Develop and maintain positive working relationships support team to reach common goals listen and respond appropriately to the concerns of employees Comply with quality assurance standards Stand sit or walk for an extended period of time,Role Guest Service AssociateIndustry Type Travel  TourismDepartment Food Beverage  HospitalityEmployment Type Full Time PermanentRole Category Front Office  Guest Services,EducationUG Any GraduatePG Any Postgraduate,Key SkillsHousekeepingTrainingSupervisorStationHospitalityLoss preventionFront officeManager Quality AssuranceFocusBilling,4.21130,,1
Housekeeping Associate,Marriott,Kolkata,Respond promptly to requests from guests and other departments Fill cart with supplies and transport cart to assigned area Enter guest rooms following procedures for gaining access and ensuring vacancy before entering Replace guest amenities and supplies in rooms Replace dirty linens and terry with clean items Make beds and fold terry Clean bathrooms Remove trash dirty linen and room service items Check that all appliances are present in the room and in working order Straighten desk items furniture and appliances Dust polish and remove marks from walls and furnishings Vacuum carpets and performs floor care duties eg in guest rooms and hallway     Follow all company and safety and security policies and procedures report any maintenance problems safety hazards accidents or injuries complete safety training and certifications properly store flammable materials Ensure uniform and personal appearance are clean and professional maintain confidentiality of proprietary information Welcome and acknowledge all guests according to company standards anticipate and address guests service needs assist individuals with disabilities thank guests with genuine appreciation Speak with others using clear and professional language Support team to reach common goals Ensure adherence to quality expectations and standards Move lift carry and place objects weighing less than or equal to  pounds without assistance and in excess of  pounds with assistance Ability to push and pull a loaded housekeeping cart and other workrelated equipment over sloping and uneven surfaces Reach overhead and below the knees including bending twisting pulling and stooping Stand sit kneel or walk for an extended period across an entire work shift Grasp turn and manipulate objects of varying size and weight requiring fine motor skills and handeye coordination Perform other reasonable job duties as requested by Supervisors,Role Housekeeping Executive  AttendantIndustry Type Travel  TourismDepartment Food Beverage  HospitalityEmployment Type Full Time PermanentRole Category Housekeeping  Laundry,EducationUG Any GraduatePG Any Postgraduate,Key SkillsHousekeepingSupervisorHospitalityHousekeeping AssociateAppliancesSafety trainingRoom serviceProgrammingWellnessManagement,4.21130,,1
Guest Service Associate - Food and Beverage Service,Marriott,Kolkata,Serve food courses and alcoholic beverages to guests Set tables according to type of event and service standards Answer questions on menu selections Communicate with the kitchen regarding menu questions the length of wait recook orders and product availability Communicate additional meal requirements allergies dietary needs and special requests to the kitchen Record transaction in MICROS system at time of order Check in with guests to ensure satisfaction with each food course andor beverages Maintain cleanliness of work areas china glass etc throughout the day Complete closing duties including restocking items turning off lights etc Present physical and accurate check to guest and process payment     Follow all company and safety and security policies and procedures report accidents injuries and unsafe work conditions to manager and complete safety training and certifications Ensure uniform and personal appearance are clean and professional maintain confidentiality of proprietary information and protect company assets Welcome and acknowledge all guests according to company standards anticipate and address guests service needs assist individuals with disabilities and thank guests with genuine appreciation Speak with others using clear and professional language Develop and maintain positive working relationships with others support team to reach common goals and listen and respond appropriately to the concerns of other employees    Ensure adherence to quality expectations and standards Read and visually verify information in a variety of formats eg small print Stand sit or walk for an extended period of time or for an entire work shift Move lift carry push pull and place objects weighing less than or equal to  pounds without assistance and objects weighing in excess of  pounds with assistance Grasp turn and manipulate objects of varying size and weight requiring fine motor skills and handeye coordination Move over sloping uneven or slippery surfaces as well as up and down stairs andor service ramps Reach overhead and below the knees including bending twisting pulling and stooping Perform other reasonable job duties as requested by Supervisors,Role Guest Service AssociateIndustry Type Travel  TourismDepartment Food Beverage  HospitalityEmployment Type Full Time PermanentRole Category Front Office  Guest Services,EducationUG Any GraduatePG Any Postgraduate,Key SkillsTrainingSupervisorPrintingHospitalitySafety trainingFocusCookManagementGuest Service Associate,4.21130,,1
Commis,Marriott,Kolkata,Prepare ingredients for cooking including portioning chopping and storing food Wash and peel fresh fruits and vegetables Weigh measure and mix ingredients Prepare and cook food according to recipes quality standards presentation standards and food preparation checklist Prepare cold foods Operate ovens stoves grills microwaves and fryers Test foods to determine if they have been cooked sufficiently Monitor food quality while preparing food Setup and break down work station Serve food in proper portions onto proper receptacles Wash and disinfect kitchen area tables tools knives and equipment Check and ensure the correctness of the temperature of appliances and food     Follow all company and safety and security policies and procedures report maintenance needs accidents injuries and unsafe work conditions to manager complete safety training and certifications Ensure uniform and personal appearance are clean and professional maintain confidentiality of proprietary information protect company assets Speak with others using clear and professional language    Develop and maintain positive working relationships with others support team to reach common goals listen and respond appropriately to the concerns of other employees Ensure adherence to quality expectations and standards Stand sit or walk for an extended period of time or for an entire work shift Reach overhead and below the knees including bending twisting pulling and stooping,Role Commis Commi     Industry Type Travel  TourismDepartment Food Beverage  HospitalityEmployment Type Full Time PermanentRole Category Kitchen  FB Production,EducationUG Any GraduatePG Any Postgraduate,Key SkillsTrainingSupervisorHospitalityQuality standardsCookingAppliancesSafety trainingFocuscommisMonitoring,4.21130,,1
MEGA Drive For Airtel Xstream Fiber Field Sales Executive For Kolkata,Teamlease Services Limited,KolkataWest Bengal Sodepur Belgharia New Town Garia Rajarhat Salt Lake Barrackpore Dum Dum Metro Dum Dum Dunlop Khardah Naihati Kalyani Bidhan Nagar,Mega Hiring Drive for Indias leading TelecomBroadband Company Bharti Airtel Ltd Designation  XFE Xstream Fibre ExecutiveWork Experience Up to  years of experience broad band experience will be an added advantage                                                    FRESHERS ALSO CAN APPLY   Salary  Salary basis the Minimum wages of the state Deserving Candidate Salary can be discussed with Circle SPOC  approval sought Sales Executives will be applicable for all other Incentive scheme champ from time to time basis  Salary and Incentive Payout to be paid in AIRTEL PAYMENTS BANK AccountQualifications  Graduate or Higher Secondary with Field Sales Expertise in TelecomBankingInsuranceNetwork MarketingRequirements  Age Group  Years to  Years Excellent Personality  presentable Very Good Communication  Presentation Skills Up to  years of experience broad band experience will be an added advantage Excellent Command over the local language of the state Conversing in English being an added advantage Well versed skill set for approaching  handling customer Selfmotivated sincere  committed to deliver the results Smartphone is a must have and should be well versed in app knowledge Personal Vehicle  Two Wheeler Mandatory with Driving licenseJob Description  Achieve the monthly Sales target for Airtel Broadband by connecting with potential customers  convincing them to purchase broadband connection Identify Approach  Inform potential customers about the advantages of installing  subscribing to Airtel Broadband To mark their presence regularly marking in  out attendance in the Airtel APP Visit household retailers across designated area  look for potential customers to convince them for purchasing Airtel Broadband Responsible for developing leads of the prospective customers  approach them Responsible for providing on time competition feedback to circle Airtel Team To be up to date on company products  its features launched from time to timeInterested candidates can drop their resumes below undersignedEmail ID  shibangydasteamleasecomWhatsapp Number,Role Field Sales ExecutiveIndustry Type Telecom  ISPDepartment Sales  Business DevelopmentEmployment Type Full Time PermanentRole Category Retail  BC Sales,EducationUG Graduation Not Required,Key SkillsSkills highlighted with ‘‘ are preferred keyskillsFIELD SALESEXECUTIVEField Sales ManagementOutside SalesB2C MarketingField SalesField MarketingField WorkB2B SalesSales Executive Activities,3.92727,,30
HR Assistant,Indusind Bank,KolkataWest Bengal,Role  responsibilities  Assist with day to day operations of the HR functions and dutiesProvide clerical and administrative support to Regional HRCompile and update employee records hard and soft copiesProcess documentation and prepare reports relating to personnel activitiesDeal with employee requests regarding human resources issues rules and regulationsAssist in payroll preparation by providing relevant dataCoordinate communication with candidates and schedule interviewsConduct initial orientation to newly hired employeesAssist RHR for Onboarding process and documentation Mandatory Expectations   Excellent verbal and written communication skillsPunctuality and ability to meet deadlinesStrong team spirit and collaboration skillsCommitment to ethical work practices and professionalismResponsible and reliable work approachEnthusiasm for work and a positive attitude Right mindset and attitude towards work and colleagues,Role Human Resources  OtherIndustry Type BankingDepartment Human ResourcesEmployment Type Full Time TemporaryContractualRole Category Human Resources  Other,EducationUG Any GraduatePG Any Postgraduate,Key SkillsSkills highlighted with ‘‘ are preferred keyskillsHR Generalist ActivitiesHR CoordinationJoining FormalitiesPayroll ProcessingOnboardingPayroll Management,3.79014,147.0,1
